{
  "schema_version": "agent-dispatch.sync-checkpoint-plan/v1", "plan_id": "checkpoint-plan-001", "group_id": "wiki-pair",
  "expected_content_predecessor": "1111111111111111111111111111111111111111", "expected_membership_revision": "1111111111111111111111111111111111111111",
  "proposed_checkpoint": {"schema_version":"agent-dispatch.sync-checkpoint/v1","checkpoint_id":"checkpoint-001","group_id":"wiki-pair","kind":"initial_baseline","target_commit":"2222222222222222222222222222222222222222","snapshot_digest":"sha256:aaaaaaaaaaaaaaaaaaaaaaaaaaaaaaaaaaaaaaaaaaaaaaaaaaaaaaaaaaaaaaaa","scope_digest":"sha256:1e134a9296b8652b4fd887c8be2c2596caee32ac0523f058d516af8fd4958320","contract_digest":"sha256:30cf47b1bd854a0271aa9df3e7b37f0cc14cdd86d3f06a65a2cb787c6741131b","membership_revision":"1111111111111111111111111111111111111111","administrator_key":"SHA256:AAAAAAAAAAAAAAAAAAAAAAAAAAAAAAAAAAAAAAAAAAA"},
  "administrator_key": "SHA256:AAAAAAAAAAAAAAAAAAAAAAAAAAAAAAAAAAAAAAAAAAA"
}
